Week 4 - Jun Yan Gan (101197834)


root@comp3134-junyangan:~# tcpdump -n -i eth0

tcpdump: verbose output suppressed, use -v or -vv for full protocol decode
listening on eth0, link-type EN10MB (Ethernet), capture size 262144 bytes
21:32:02.663997 IP 138.197.151.44.22 > 204.19.189.121.60376: Flags [P.], seq 350089906:350090014, ack 2488459786, win 501, length 108
21:32:02.664160 IP 138.197.151.44.22 > 204.19.189.121.60376: Flags [P.], seq 108:252, ack 1, win 501, length 144
21:32:02.664270 IP 138.197.151.44.22 > 204.19.189.121.60376: Flags [P.], seq 252:288, ack 1, win 501, length 36
21:32:02.664532 IP 138.197.151.44.22 > 204.19.189.121.60376: Flags [P.], seq 288:460, ack 1, win 501, length 172
21:32:02.664628 IP 138.197.151.44.22 > 204.19.189.121.60376: Flags [P.], seq 460:496, ack 1, win 501, length 36
21:32:02.664741 IP 138.197.151.44.22 > 204.19.189.121.60376: Flags [P.], seq 496:644, ack 1, win 501, length 148
21:32:02.664834 IP 138.197.151.44.22 > 204.19.189.121.60376: Flags [P.], seq 644:680, ack 1, win 501, length 36
21:32:02.664942 IP 138.197.151.44.22 > 204.19.189.121.60376: Flags [P.], seq 680:828, ack 1, win 501, length 148
21:32:02.665025 IP 138.197.151.44.22 > 204.19.189.121.60376: Flags [P.], seq 828:864, ack 1, win 501, length 36
21:32:02.673155 IP 204.19.189.121.60376 > 138.197.151.44.22: Flags [.], ack 496, win 515, length 0
21:32:02.673250 IP 138.197.151.44.22 > 204.19.189.121.60376: Flags [P.], seq 864:1968, ack 1, win 501, length 1104
21:32:02.673575 IP 138.197.151.44.22 > 204.19.189.121.60376: Flags [P.], seq 1968:2100, ack 1, win 501, length 132
21:32:02.673605 IP 204.19.189.121.60376 > 138.197.151.44.22: Flags [.], ack 864, win 513, length 0
21:32:02.673760 IP 138.197.151.44.22 > 204.19.189.121.60376: Flags [P.], seq 2100:2136, ack 1, win 501, length 36
21:32:02.673950 IP 138.197.151.44.22 > 204.19.189.121.60376: Flags [P.], seq 2136:2284, ack 1, win 501, length 148
21:32:02.674107 IP 138.197.151.44.22 > 204.19.189.121.60376: Flags [P.], seq 2284:2320, ack 1, win 501, length 36
21:32:02.674250 IP 138.197.151.44.22 > 204.19.189.121.60376: Flags [P.], seq 2320:2468, ack 1, win 501, length 148
21:32:02.674425 IP 138.197.151.44.22 > 204.19.189.121.60376: Flags [P.], seq 2468:2504, ack 1, win 501, length 36
21:32:02.674580 IP 138.197.151.44.22 > 204.19.189.121.60376: Flags [P.], seq 2504:2636, ack 1, win 501, length 132
21:32:02.674679 IP 138.197.151.44.22 > 204.19.189.121.60376: Flags [P.], seq 2636:2672, ack 1, win 501, length 36
21:32:02.674775 IP 138.197.151.44.22 > 204.19.189.121.60376: Flags [P.], seq 2672:2820, ack 1, win 501, length 148
21:32:02.674863 IP 138.197.151.44.22 > 204.19.189.121.60376: Flags [P.], seq 2820:2856, ack 1, win 501, length 36
21:32:02.674956 IP 138.197.151.44.22 > 204.19.189.121.60376: Flags [P.], seq 2856:3004, ack 1, win 501, length 148
21:32:02.675041 IP 138.197.151.44.22 > 204.19.189.121.60376: Flags [P.], seq 3004:3040, ack 1, win 501, length 36
21:32:02.675150 IP 138.197.151.44.22 > 204.19.189.121.60376: Flags [P.], seq 3040:3188, ack 1, win 501, length 148
21:32:02.675243 IP 138.197.151.44.22 > 204.19.189.121.60376: Flags [P.], seq 3188:3224, ack 1, win 501, length 36
21:32:02.675393 IP 138.197.151.44.22 > 204.19.189.121.60376: Flags [P.], seq 3224:3372, ack 1, win 501, length 148
21:32:02.675498 IP 138.197.151.44.22 > 204.19.189.121.60376: Flags [P.], seq 3372:3408, ack 1, win 501, length 36
21:32:02.675609 IP 138.197.151.44.22 > 204.19.189.121.60376: Flags [P.], seq 3408:3556, ack 1, win 501, length 148
21:32:02.682504 IP 204.19.189.121.60376 > 138.197.151.44.22: Flags [.], ack 2320, win 515, length 0
21:32:02.682599 IP 138.197.151.44.22 > 204.19.189.121.60376: Flags [P.], seq 3556:5616, ack 1, win 501, length 2060
21:32:02.682886 IP 138.197.151.44.22 > 204.19.189.121.60376: Flags [P.], seq 5616:5756, ack 1, win 501, length 140
21:32:02.682992 IP 138.197.151.44.22 > 204.19.189.121.60376: Flags [P.], seq 5756:5792, ack 1, win 501, length 36
21:32:02.683066 IP 204.19.189.121.60376 > 138.197.151.44.22: Flags [.], ack 2636, win 514, length 0
21:32:02.683178 IP 138.197.151.44.22 > 204.19.189.121.60376: Flags [P.], seq 5792:5948, ack 1, win 501, length 156
21:32:02.683295 IP 138.197.151.44.22 > 204.19.189.121.60376: Flags [P.], seq 5948:5984, ack 1, win 501, length 36
21:32:02.683416 IP 138.197.151.44.22 > 204.19.189.121.60376: Flags [P.], seq 5984:6132, ack 1, win 501, length 148
21:32:02.683502 IP 138.197.151.44.22 > 204.19.189.121.60376: Flags [P.], seq 6132:6168, ack 1, win 501, length 36
21:32:02.683608 IP 138.197.151.44.22 > 204.19.189.121.60376: Flags [P.], seq 6168:6316, ack 1, win 501, length 148
21:32:02.683703 IP 204.19.189.121.60376 > 138.197.151.44.22: Flags [.], ack 3188, win 511, length 0
21:32:02.683720 IP 138.197.151.44.22 > 204.19.189.121.60376: Flags [P.], seq 6316:6352, ack 1, win 501, length 36
21:32:02.683835 IP 138.197.151.44.22 > 204.19.189.121.60376: Flags [P.], seq 6352:6492, ack 1, win 501, length 140
21:32:02.683924 IP 138.197.151.44.22 > 204.19.189.121.60376: Flags [P.], seq 6492:6528, ack 1, win 501, length 36
21:32:02.684028 IP 138.197.151.44.22 > 204.19.189.121.60376: Flags [P.], seq 6528:6676, ack 1, win 501, length 148
21:32:02.684116 IP 138.197.151.44.22 > 204.19.189.121.60376: Flags [P.], seq 6676:6712, ack 1, win 501, length 36
21:32:02.684219 IP 204.19.189.121.60376 > 138.197.151.44.22: Flags [.], ack 3556, win 510, length 0
21:32:02.684303 IP 138.197.151.44.22 > 204.19.189.121.60376: Flags [P.], seq 6712:6860, ack 1, win 501, length 148
21:32:02.684447 IP 138.197.151.44.22 > 204.19.189.121.60376: Flags [P.], seq 6860:6896, ack 1, win 501, length 36
21:32:02.684610 IP 138.197.151.44.22 > 204.19.189.121.60376: Flags [P.], seq 6896:7044, ack 1, win 501, length 148
21:32:02.684713 IP 138.197.151.44.22 > 204.19.189.121.60376: Flags [P.], seq 7044:7080, ack 1, win 501, length 36
21:32:02.684836 IP 138.197.151.44.22 > 204.19.189.121.60376: Flags [P.], seq 7080:7228, ack 1, win 501, length 148
21:32:02.684931 IP 138.197.151.44.22 > 204.19.189.121.60376: Flags [P.], seq 7228:7264, ack 1, win 501, length 36
21:32:02.685054 IP 138.197.151.44.22 > 204.19.189.121.60376: Flags [P.], seq 7264:7412, ack 1, win 501, length 148
21:32:02.685146 IP 138.197.151.44.22 > 204.19.189.121.60376: Flags [P.], seq 7412:7448, ack 1, win 501, length 36
21:32:02.691754 IP 204.19.189.121.60376 > 138.197.151.44.22: Flags [.], ack 5984, win 515, length 0
21:32:02.691868 IP 138.197.151.44.22 > 204.19.189.121.60376: Flags [P.], seq 7448:10100, ack 1, win 501, length 2652
21:32:02.692136 IP 138.197.151.44.22 > 204.19.189.121.60376: Flags [P.], seq 10100:10240, ack 1, win 501, length 140
21:32:02.692324 IP 138.197.151.44.22 > 204.19.189.121.60376: Flags [P.], seq 10240:10276, ack 1, win 501, length 36
21:32:02.692495 IP 138.197.151.44.22 > 204.19.189.121.60376: Flags [P.], seq 10276:10432, ack 1, win 501, length 156
21:32:02.692708 IP 138.197.151.44.22 > 204.19.189.121.60376: Flags [P.], seq 10432:10588, ack 1, win 501, length 156
21:32:02.692893 IP 204.19.189.121.60376 > 138.197.151.44.22: Flags [.], ack 6896, win 511, length 0
21:32:02.693036 IP 138.197.151.44.22 > 204.19.189.121.60376: Flags [P.], seq 10588:10744, ack 1, win 501, length 156
21:32:02.693236 IP 138.197.151.44.22 > 204.19.189.121.60376: Flags [P.], seq 10744:10900, ack 1, win 501, length 156
21:32:02.693369 IP 204.19.189.121.60376 > 138.197.151.44.22: Flags [.], ack 7448, win 515, length 0
